{
  "$schema": "http://json-schema.org/draft-07/schema#",
  "title": "MOT Simulation Configuration (with defaults)",
  "type": "object",
  "required": [
    "Atoms",
    "Magnetic_Fields",
    "Lasers",
    "Boundaries",
    "Simulation"
  ],
  "properties": {
    "Atoms": {
      "type": "object",
      "default": {
        "species": "Li6",
        "number": 5000,
        "start_position": [0.0, -0.02, 0.0],
        "start_velocity": [0.0, 50.0, 0.0],
        "natural_linewidth": 5.87,
        "ground_state": 0,
        "randomize_ground_state": true,
        "sample_style": "oven",
        "sample_file": "starting condition samples/623K Oven.csv"
      },
      "required": [
        "species",
        "number",
        "start_position",
        "start_velocity",
        "ground_state",
        "randomize_ground_state"
      ],
      "properties": {
        "species": { "type": "string", "default": "Li6" },
        "number": { "type": "integer", "minimum": 1, "default": 5000 },
        "start_position": { "$ref": "#/definitions/vector3", "default": [0.0, -0.02, 0.0] },
        "start_velocity": { "$ref": "#/definitions/vector3", "default": [0.0, 50.0, 0.0] },
        "natural_linewidth": { "type": "number", "minimum": 0, "default": 5.87 },
        "ground_state": { "type": "integer", "minimum": 0, "default": 0 },
        "randomize_ground_state": { "type": "boolean", "default": true },
        "sample_style": {
          "type": "string",
          "enum": ["oven", "snapshot"],
          "default": "oven"
        },
        "sample_file": { "type": "string", "default": "starting condition samples/623K Oven.csv" }
      },
      "additionalProperties": false
    },

    "Magnetic_Fields": {
    "type": "object",
    "default": {
      "type": "DipoleBarMagneticField",
      "center_offset": [0, 0, 0.0],
      "g_y": -0.5,
      "g_x": 0.5,
      "theta_deg": 45.0,
      "dipoles": [
        {
          "position": [0.042, 0.0, 0.021],
          "dimension": [0.025, 0.009, 0.01],
          "orientation": [0.0, -1.0, 0.0],
          "magnetization": 880000.0
        }
      ]
    },
    "required": ["type"],
    "properties": {
      "type": { "type": "string" }
    },
    "allOf": [
      {
        "if": { "properties": { "type": { "const": "DipoleBarMagneticField" } } },
        "then": {
          "type": "object",
          "properties": {
            "type": { "const": "DipoleBarMagneticField" },
            "center_offset": { "$ref": "#/definitions/vector3" },
            "g_y": { "type": "number" },
            "g_x": { "type": "number" },
            "theta_deg": { "type": "number" },
            "dipoles": {
              "type": "array",
              "minItems": 1,
              "items": {
                "type": "object",
                "required": ["position", "dimension", "orientation", "magnetization"],
                "properties": {
                  "position": { "$ref": "#/definitions/vector3" },
                  "dimension": { "$ref": "#/definitions/vector3" },
                  "orientation": { "$ref": "#/definitions/vector3" },
                  "magnetization": { "type": "number" }
                },
                "additionalProperties": false
              }
            }
          },
          "required": ["type", "center_offset", "g_y", "g_x", "theta_deg", "dipoles"],
          "additionalProperties": false
        }
      },

      {
        "if": { "properties": { "type": { "const": "CuboidBarMagneticField" } } },
        "then": {
          "type": "object",
          "properties": {
            "type": { "const": "CuboidBarMagneticField" },
            "center_offset": { "$ref": "#/definitions/vector3" },
            "dipoles": {
              "type": "array",
              "minItems": 1,
              "items": {
                "type": "object",
                "required": ["position", "dimension", "orientation", "magnetization"],
                "properties": {
                  "position": { "$ref": "#/definitions/vector3" },
                  "dimension": { "$ref": "#/definitions/vector3" },
                  "orientation": { "$ref": "#/definitions/vector3" },
                  "magnetization": { "type": "number" }
                },
                "additionalProperties": false
              }
            }
          },
          "required": ["type", "dipoles"],
          "additionalProperties": false
        }
      },

      {
        "if": { "properties": { "type": { "const": "GridFieldModel" } } },
        "then": {
          "type": "object",
          "properties": {
            "type": { "const": "GridFieldModel" },
            "grid_file": { "type": "string" },
            "center_offset": { "$ref": "#/definitions/vector3" },
            "dipoles": {
              "type": "array",
              "minItems": 1,
              "items": {
                "type": "object",
                "required": ["position", "dimension", "orientation", "magnetization"],
                "properties": {
                  "position": { "$ref": "#/definitions/vector3" },
                  "dimension": { "$ref": "#/definitions/vector3" },
                  "orientation": { "$ref": "#/definitions/vector3" },
                  "magnetization": { "type": "number" }
                },
                "additionalProperties": false
              }
            }
          },
          "required": ["type", "grid_file", "dipoles"],
          "additionalProperties": false
        }
      },

      {
        "if": { "properties": { "type": { "const": "IdealQuadrupoleField" } } },
        "then": {
          "type": "object",
          "properties": {
            "type": { "const": "IdealQuadrupoleField" },
            "center_offset": { "$ref": "#/definitions/vector3" },
            "field_gradient": { "type": "number" }
          },
          "required": ["type", "field_gradient"],
          "additionalProperties": false
        }
      },

      {
        "if": { "properties": { "type": { "const": "ZeemanField" } } },
        "then": {
          "type": "object",
          "properties": {
            "type": { "const": "ZeemanField" },
            "slower_length": { "type": "number", "minimum": 0 },
            "B_0": { "type": "number" },
            "B_Bias": { "type": "number" },
            "B_bias": { "type": "number" },           
            "delta_B": { "type": "number" },
            "delta_B_min": { "type": "number" }
          },
          "required": ["type"],
          "additionalProperties": false
        }
      },

      {
        "if": { "properties": { "type": { "const": "EllipticalMagneticField" } } },
        "then": {
          "type": "object",
          "properties": {
            "type": { "const": "EllipticalMagneticField" },
            "center_offset": { "$ref": "#/definitions/vector3" },
            "g_x": { "type": "number" },
            "g_y": { "type": "number" },
            "theta_deg": { "type": "number" }
          },
          "required": ["type", "g_x", "g_y", "theta_deg"],
          "additionalProperties": false
        }
      }
    ]
  }
  ,

    "Lasers": {
      "type": "array",
      "default": [
        {
          "waist": 0.009,
          "origin": [0.25, 0.25, 0.0],
          "direction": [-1.0, -1.0, 0.0],
          "beam_power": 0.05,
          "beam_frequency": 446799571.079,
          "detuning": -7.5,
          "handedness": 1,
          "type": "trap"
        },
        {
          "waist": 0.009,
          "origin": [-0.25, -0.25, 0.0],
          "direction": [1.0, 1.0, 0.0],
          "beam_power": 0.05,
          "beam_frequency": 446799571.079,
          "detuning": -7.5,
          "handedness": 1,
          "type": "trap"
        },
        {
          "waist": 0.009,
          "origin": [-0.25, 0.25, 0.0],
          "direction": [1.0, -1.0, 0.0],
          "beam_power": 0.05,
          "beam_frequency": 446799571.079,
          "detuning": -7.5,
          "handedness": -1,
          "type": "trap"
        },
        {
          "waist": 0.009,
          "origin": [0.25, -0.25, 0.0],
          "direction": [-1.0, 1.0, 0.0],
          "beam_power": 0.05,
          "beam_frequency": 446799571.079,
          "detuning": -7.5,
          "handedness": -1,
          "type": "trap"
        },
        {
          "waist": 0.009,
          "origin": [0.25, 0.25, 0.0],
          "direction": [-1.0, -1.0, 0.0],
          "beam_power": 0.048,
          "beam_frequency": 446799802.175,
          "detuning": -1.0,
          "handedness": 1,
          "type": "repump"
        },
        {
          "waist": 0.009,
          "origin": [-0.25, 0.25, 0.0],
          "direction": [1.0, -1.0, 0.0],
          "beam_power": 0.048,
          "beam_frequency": 446799802.175,
          "detuning": -1.0,
          "handedness": -1,
          "type": "repump"
        },
        {
          "waist": 0.009,
          "origin": [-0.25, -0.25, 0.0],
          "direction": [1.0, 1.0, 0.0],
          "beam_power": 0.048,
          "beam_frequency": 446799802.175,
          "detuning": -1.0,
          "handedness": 1,
          "type": "repump"
        },
        {
          "waist": 0.009,
          "origin": [0.25, -0.25, 0.0],
          "direction": [-1.0, 1.0, 0.0],
          "beam_power": 0.048,
          "beam_frequency": 446799802.175,
          "detuning": -1.0,
          "handedness": -1,
          "type": "repump"
        }
      ],
      "items": {
        "type": "object",
        "required": [
          "type",
          "waist",
          "origin",
          "direction",
          "beam_power",
          "beam_frequency",
          "detuning",
          "handedness"
        ],
        "properties": {
          "type": { "type": "string", "enum": ["trap", "repump", "unspecified"], "default": "trap" },
          "waist": { "type": "number", "minimum": 0, "default": 0.009 },
          "origin": { "$ref": "#/definitions/vector3", "default": [0.25, 0.25, 0.0] },
          "direction": { "$ref": "#/definitions/vector3", "default": [-1.0, -1.0, 0.0] },
          "beam_power": { "type": "number", "minimum": 0, "default": 0.05 },
          "beam_frequency": { "type": "number", "minimum": 0, "default": 446799571.079 },
          "detuning": { "type": "number", "default": -7.5 },
          "handedness": { "type": "integer", "enum": [-1,0, 1], "default": 1 },
          "t_on": { "type": "number", "minimum": 0, "default": 0.0 },
          "t_off": { "type": ["number", "null"], "minimum": 0, "default": null },
          "modulation": { "type": ["string", "null"], "default": null }
        },
        "additionalProperties": false
      }
    },

    "Modulations": {
      "type": "array",
      "default": [],
      "items": {
        "type": "object",
        "required": ["name", "frequency", "plateau_width"],
        "properties": {
          "name": { "type": "string", "minLength": 1 },
          "shape": { "type": "string", "enum": ["square"], "default": "square" },
          "frequency": { "type": "number", "exclusiveMinimum": 0 },
          "plateau_width": { "type": "number", "exclusiveMinimum": 0 },
          "min": { "type": "number", "minimum": 0, "maximum": 1, "default": 0.0 },
          "max": { "type": "number", "minimum": 0, "maximum": 1, "default": 1.0 },
          "phase": { "type": "number", "default": 0.0 },
          "rest": { "type": "number", "minimum": 0, "maximum": 1, "default": 1.0 },
          "t_on": { "type": "number", "minimum": 0, "default": 0.0 },
          "t_off": { "type": ["number", "null"], "minimum": 0, "default": null }
        },
        "additionalProperties": false
      }
    },

    "Boundaries": {
      "type": "object",
      "default": {"x_limit": 30.0,
                  "y_limit": 30.0,
                  "z_limit": 30.0},
      "required": [
        "x_limit",
        "y_limit",
        "z_limit"]
    },

    "Simulation": {
      "type": "object",
      "default": {
        "interaction": "Lithium18LevelInteraction",
        "step_resolution": 1,
        "simulated_time": 4.0,
        "random_seed": 15,
        "rate_mode": false,
        "flux": 6.7,
        "macro_particle_weight": 2000,
        "default_time_step": 10.0
      },
      "required": [
        "interaction",
        "step_resolution",
        "simulated_time",
        "random_seed",
        "rate_mode",
        "flux",
        "macro_particle_weight",
        "default_time_step"
      ],
      "properties": {
        "interaction": { "type": "string", "default": "Lithium18LevelInteraction" },
        "interaction_table_file": { "type": "string" },
        "step_resolution": { "type": "integer", "minimum": 1, "default": 1 },
        "simulated_time": { "type": "number", "minimum": 0, "default": 4.0 },
        "random_seed": { "type": "integer", "default": 15 },
        "rate_mode": { "type": "boolean", "default": false },
        "flux": { "type": "number", "minimum": 0, "default": 6.7 },
        "macro_particle_weight": { "type": "number", "minimum": 1, "default": 2000 },
        "default_time_step": { "type": "number", "minimum": 0, "default": 10.0 },
        "injection_cutoff_time": { "type": "number", "minimum": 0 },
        "step_mode": { "type": "string" },
        "step_limit": { "type": "integer", "minimum": 1 },
        "max_step_number": { "type": "integer", "minimum": 1 }
      },
      "additionalProperties": false
    }
  },

  "definitions": {
    "vector3": {
      "type": "array",
      "minItems": 3,
      "maxItems": 3,
      "items": { "type": "number" }
    }
  },

  "additionalProperties": false
}
