{
    "Atoms": {
        "species": "Li6",
        "number": 3000,
        "start_position": [
            0.0,
            0.0,
            0.0
        ],
        "start_velocity": [
            0.0,
            500.0,
            0.0
        ],
        "natural_linewidth": 5.87,
        "ground_state": 1,
        "randomize_ground_state": true,
        "sample_file": ""
    },
    "Magnetic_Fields": {
        "type": "ZeemanField",
        "slower_length": 0.7,
        "B_0": 0.079,
        "B_bias": 0.0,
        "delta_B": 0.1,
        "delta_B_min": 1e-05
    },
    "Lasers": [
        {
            "waist": 0.011,
            "origin": [
                0.0,
                1.8,
                0.0
            ],
            "direction": [
                0.0,
                -1.0,
                0.0
            ],
            "beam_power": 0.11,
            "beam_frequency": 446799648.079,
            "detuning": -3.0,
            "handedness": -1,
            "type": "trap"
        }
    ],
    "Boundaries": {
        "x_limit": 27.0,
        "y_limit": 710.0,
        "z_limit": 27.0
    },
    "Simulation": {
        "interaction": "SimpleEighteenLevelInteraction",
        "step_resolution": 1,
        "simulated_time": 9.0,
        "random_seed": 10,
        "rate_mode": false,
        "flux": 3.0,
        "macro_particle_weight": 7500,
        "default_time_step": 10.0
    }
}