{
    "Atoms": {
        "species": "Li6",
        "number": 15000,
        "start_position": [
            0.0,
            -0.02,
            0.0
        ],
        "start_velocity": [
            0.0,
            50.0,
            0.0
        ],
        "natural_linewidth": 5.87,
        "ground_state": 0,
        "randomize_ground_state": true,
        "sample_file": "starting condition samples/623K Oven.csv"
    },
    "Magnetic_Fields": {
        "type": "CuboidBarMagneticField",
        "center_offset": [
            0.0,
            0.0,
            0.0
        ],
        "dipoles": [
            {
                "position": [
                    0.042,
                    0.0,
                    0.0185
                ],
                "dimension": [
                    0.01,
                    0.009,
                    0.025
                ],
                "orientation": [
                    0.0,
                    -1.0,
                    0.0
                ],
                "magnetization": 880000.0
            },
            {
                "position": [
                    0.042,
                    0.0,
                    -0.0185
                ],
                "dimension": [
                    0.01,
                    0.009,
                    0.025
                ],
                "orientation": [
                    0.0,
                    -1.0,
                    0.0
                ],
                "magnetization": 880000.0
            },
            {
                "position": [
                    -0.042,
                    0.0,
                    0.0185
                ],
                "dimension": [
                    0.01,
                    0.009,
                    0.025
                ],
                "orientation": [
                    0.0,
                    1.0,
                    0.0
                ],
                "magnetization": 880000.0
            },
            {
                "position": [
                    -0.042,
                    0.0,
                    -0.0185
                ],
                "dimension": [
                    0.01,
                    0.009,
                    0.025
                ],
                "orientation": [
                    0.0,
                    1.0,
                    0.0
                ],
                "magnetization": 880000.0
            }
        ]
    },
    "Lasers": [
        {
            "waist": 0.009,
            "origin": [
                0.25,
                0.25,
                0.0
            ],
            "direction": [
                -1.0,
                -1.0,
                0.0
            ],
            "beam_power": 0.05,
            "beam_frequency": 446799571.079,
            "detuning": -7.5,
            "handedness": 1,
            "type": "trap"
        },
        {
            "waist": 0.009,
            "origin": [
                -0.25,
                -0.25,
                0.0
            ],
            "direction": [
                1.0,
                1.0,
                0.0
            ],
            "beam_power": 0.05,
            "beam_frequency": 446799571.079,
            "detuning": -7.5,
            "handedness": 1,
            "type": "trap"
        },
        {
            "waist": 0.009,
            "origin": [
                -0.25,
                0.25,
                0.0
            ],
            "direction": [
                1.0,
                -1.0,
                0.0
            ],
            "beam_power": 0.05,
            "beam_frequency": 446799571.079,
            "detuning": -7.5,
            "handedness": -1,
            "type": "trap"
        },
        {
            "waist": 0.009,
            "origin": [
                0.25,
                -0.25,
                0.0
            ],
            "direction": [
                -1.0,
                1.0,
                0.0
            ],
            "beam_power": 0.05,
            "beam_frequency": 446799571.079,
            "detuning": -7.5,
            "handedness": -1,
            "type": "trap"
        },
        {
            "waist": 0.009,
            "origin": [
                0.25,
                0.25,
                0.0
            ],
            "direction": [
                -1.0,
                -1.0,
                0.0
            ],
            "beam_power": 0.048,
            "beam_frequency": 446799802.175,
            "detuning": -1.0,
            "handedness": 1,
            "type": "repump"
        },
        {
            "waist": 0.009,
            "origin": [
                -0.25,
                0.25,
                0.0
            ],
            "direction": [
                1.0,
                -1.0,
                0.0
            ],
            "beam_power": 0.048,
            "beam_frequency": 446799802.175,
            "detuning": -1.0,
            "handedness": -1,
            "type": "repump"
        },
        {
            "waist": 0.009,
            "origin": [
                -0.25,
                -0.25,
                0.0
            ],
            "direction": [
                1.0,
                1.0,
                0.0
            ],
            "beam_power": 0.048,
            "beam_frequency": 446799802.175,
            "detuning": -1.0,
            "handedness": 1,
            "type": "repump"
        },
        {
            "waist": 0.009,
            "origin": [
                0.25,
                -0.25,
                0.0
            ],
            "direction": [
                -1.0,
                1.0,
                0.0
            ],
            "beam_power": 0.048,
            "beam_frequency": 446799802.175,
            "detuning": -1.0,
            "handedness": -1,
            "type": "repump"
        }
    ],
    "Boundaries": {
        "x_limit": 27.0,
        "y_limit": 27.0,
        "z_limit": 27.0
    },
    "Simulation": {
        "interaction": "Lithium18LevelInteraction",
        "step_resolution": 1,
        "simulated_time": 3.0,
        "random_seed": 15,
        "rate_mode": false,
        "flux": 6.7,
        "macro_particle_weight": 2000,
        "default_time_step": 10.0
    }
}